{
  "schema": {
    "id": "https://darelabs.tech/schemas/lab/v1/scenario.schema.json",
    "version": "1.0.0"
  },
  "id": "MCP-LAB-007",
  "revision": "1.0.0",
  "title": "Header/body semantic divergence",
  "family": "mcp-routing",
  "mcp": {
    "revision": "2026-07-28",
    "profile": "synthetic-lab"
  },
  "property": {
    "id": "MCP_ROUTING_SEMANTIC_CONSISTENCY",
    "description": "Routing/authorization identity must match the parsed final MCP operation"
  },
  "variants": {
    "secure": {
      "target": "secure",
      "expected": { "coverage_status": "APPLICABLE", "verdict": "PASS" }
    },
    "vulnerable": {
      "target": "vulnerable",
      "expected": { "coverage_status": "APPLICABLE", "verdict": "FAIL" }
    }
  },
  "standards": [
    {
      "source": "MCP",
      "reference": "request representation consistency",
      "status": "INFORMATIVE"
    }
  ],
  "safety": {
    "destructive": false,
    "external_network": false,
    "real_credentials": false,
    "notes": "synthetic local fixtures only"
  }
}
